{
  "$schema": "https://json-schema.org/draft/2020-12/schema",
  "$id": "https://github.com/seanmartinsmith/beadstui/pkg/view/schemas/pair_record.v2.json",
  "title": "PairRecord v2",
  "description": "Cross-project paired bead set, intent-based. Emitted only for pair groups that share an ID suffix across distinct prefixes AND have at least one cross-prefix dep edge between members. The dep edge is the authoritative intent signal; suffix collision alone no longer surfaces a pair (v1's noise mode). `intent_source` names the channel that established intent — v2 emits the literal \"dep\".",
  "type": "object",
  "additionalProperties": false,
  "required": [
    "suffix",
    "canonical",
    "mirrors",
    "intent_source"
  ],
  "properties": {
    "suffix": {
      "type": "string",
      "description": "ID suffix shared by every member of the paired set (everything after the first hyphen, e.g. 'zsy8' or 'mhwy.2')."
    },
    "canonical": {
      "$ref": "#/$defs/pairMember",
      "description": "First-created member of the paired set. Tie-broken by ID prefix ascending, then by full ID ascending."
    },
    "mirrors": {
      "type": "array",
      "description": "Remaining members of the paired set, sorted by ID prefix ascending.",
      "items": { "$ref": "#/$defs/pairMember" }
    },
    "drift": {
      "type": "array",
      "description": "Ordered list of dimensions where any mirror diverges from canonical. Omitted for in-sync pairs. Fixed output order: status, priority, closed_open. `title` drift removed in v2 (no-signal on dogfood corpus).",
      "items": {
        "type": "string",
        "enum": ["status", "priority", "closed_open"]
      }
    },
    "intent_source": {
      "type": "string",
      "enum": ["dep"],
      "description": "Channel that established intent for this pair. v2 emits the literal \"dep\" — the only currently-implemented signal. Additional values land when new intent channels exist (e.g., an upstream `paired_with` column)."
    }
  },
  "$defs": {
    "pairMember": {
      "type": "object",
      "additionalProperties": false,
      "required": ["id", "title", "status", "priority"],
      "properties": {
        "id": { "type": "string" },
        "title": { "type": "string" },
        "status": {
          "type": "string",
          "description": "Issue status (open, in_progress, blocked, deferred, pinned, hooked, review, closed, tombstone)."
        },
        "priority": { "type": "integer", "minimum": 0, "maximum": 4 },
        "source_repo": {
          "type": "string",
          "description": "Project/repo the member was loaded from. Populated by global-mode loaders; omitted for empty values."
        }
      }
    }
  }
}
